<?xml version="1.0" encoding="UTF-8"?>
<!-- edited with XML Spy v3.0 NT (http://www.xmlspy.com) by Chicago Board Options Exchange (Chicago Board Options Exchange) -->
<!DOCTYPE GlobalSubscriptionManagerHome SYSTEM "../dtd/SubscriptionManager.dtd">
<GlobalSubscriptionManagerHome>
	<SubscriptionManagerHomeImpl name="DefaultService">
		<SubscriptionManagerHomeImplProperties>
			<Users> </Users>
                        <Exchanges> </Exchanges>
			<Firms> </Firms>
			<SessionNames> </SessionNames>
			<ProductTypes> </ProductTypes>
			<Classes> </Classes>
		</SubscriptionManagerHomeImplProperties>
	</SubscriptionManagerHomeImpl>
</GlobalSubscriptionManagerHome>
